{
  "schema_version": 1,
  "id": "capability.create-agent",
  "record_version": "1.0.0",
  "status": "active",
  "name": "Create agent",
  "component_type_ids": ["component.agent"],
  "provider_ids": ["builder.agent"],
  "contract_ids": ["contract.cli.create-agent"],
  "dependency_ids": ["capability.render-template"],
  "work_order_id": "work-002"
}
